{
  "schema_version": "0.1",
  "allowed": [
    "read",
    "summarize",
    "cite",
    "transform",
    "benchmark",
    "open_issue",
    "create_pr"
  ],
  "requires_human_approval": [
    "external_post",
    "investment_recommendation",
    "private_data_access"
  ],
  "prohibited": [
    "deceptive_tracking",
    "impersonation",
    "spam",
    "bypass_paywall",
    "trading_recommendation"
  ]
}
